Sheet: main
A1: county | B1: unemployment_rate | C1: avg_temperature | D1: suicides | E1: population | F1: suicide_rate | G1: st_suicide_rate | H1: gini_index | L1: region | M1: avg_temperature | N1: tot_precipitations
A2: Torino | B2: 8.3233540000000001 | D2: 214 | E2: 2247780 | F2: =RC[-2]/RC[-1] -> 9.520504675724492E-5 | G2: =RC[-1]*100000 -> 9.5205046757244922 | H2: 0.30599999999999999 | L2: Piemonte | M2: 9.5500000000000007 | N2: 926.1
A3: Vercelli | B3: 5.1995120000000004 | D3: 15 | E3: 176941 | F3: =RC[-2]/RC[-1] -> 8.4774020718770665E-5 | G3: =RC[-1]*100000 -> 8.4774020718770657 | H3: 0.30599999999999999 | L3: Valle d'Aosta | M3: 1.8 | N3: 774.3
A4: Novara | B4: 7.5779990000000002 | D4: 27 | E4: 365559 | F4: =RC[-2]/RC[-1] -> 7.3859486430371025E-5 | G4: =RC[-1]*100000 -> 7.3859486430371026 | H4: 0.30599999999999999 | L4: Lombardia | M4: 9.9499999999999993 | N4: 808.4
A5: Cuneo | B5: 2.8928389999999999 | D5: 69 | E5: 586378 | F5: =RC[-2]/RC[-1] -> 1.1767153610810774E-4 | G5: =RC[-1]*100000 -> 11.767153610810775 | H5: 0.30599999999999999 | L5: Trentino Alto-Adige | M5: 5.95 | N5: 868.3
A6: Asti | B6: 5.8147089999999997 | D6: 19 | E6: 217573 | F6: =RC[-2]/RC[-1] -> 8.7327012083300776E-5 | G6: =RC[-1]*100000 -> 8.7327012083300772 | H6: 0.30599999999999999 | L6: Veneto | M6: 11.95 | N6: 904.3
A7: Alessandria | B7: 5.8101770000000004 | D7: 49 | E7: 427229 | F7: =RC[-2]/RC[-1] -> 1.1469258875216804E-4 | G7: =RC[-1]*100000 -> 11.469258875216804 | H7: 0.30599999999999999 | L7: Friuli-Venezia Giulia | M7: 11.35 | N7: 1116
A8: Biella | B8: 6.6974489999999998 | D8: 23 | E8: 182192 | F8: =RC[-2]/RC[-1] -> 1.2624044963554932E-4 | G8: =RC[-1]*100000 -> 12.624044963554931 | H8: 0.30599999999999999 | L8: Liguria | M8: 13.75 | N8: 969.8
A9: Verbano-Cusio-Ossola | B9: 5.110589 | D9: 12 | E9: 160264 | F9: =RC[-2]/RC[-1] -> 7.4876453851145609E-5 | G9: =RC[-1]*100000 -> 7.4876453851145612 | H9: 0.30599999999999999 | L9: Emilia-Romagna | M9: 12.75 | N9: 801.8
A10: Valle d'Aosta | B10: 4.4180450000000002 | D10: 10 | E10: 126806 | F10: =RC[-2]/RC[-1] -> 7.8860621737141779E-5 | G10: =RC[-1]*100000 -> 7.8860621737141781 | H10: 0.27600000000000002 | L10: Toscana | M10: 13.65 | N10: 833.1
A11: Imperia | B11: 6.760637 | D11: 16 | E11: 214502 | F11: =RC[-2]/RC[-1] -> 7.4591379101360362E-5 | G11: =RC[-1]*100000 -> 7.459137910136036 | H11: 0.29199999999999998 | L11: Umbria | M11: 12.4 | N11: 867.5
A12: Savona | B12: 4.9144730000000001 | D12: 18 | E12: 281028 | F12: =RC[-2]/RC[-1] -> 6.4050557239847986E-5 | G12: =RC[-1]*100000 -> 6.4050557239847983 | H12: 0.29199999999999998 | L12: Marche | M12: 13.45 | N12: 839
A13: Genova | B13: 5.5027929999999996 | D13: 28 | E13: 855834 | F13: =RC[-2]/RC[-1] -> 3.271662495296985E-5 | G13: =RC[-1]*100000 -> 3.2716624952969848 | H13: 0.29199999999999998 | L13: Lazio | M13: 13.9 | N13: 958.2
A14: La Spezia | B14: 6.5655109999999999 | D14: 11 | E14: 219330 | F14: =RC[-2]/RC[-1] -> 5.015273788355446E-5 | G14: =RC[-1]*100000 -> 5.0152737883554463 | H14: 0.29199999999999998 | L14: Abruzzo | M14: 11.95 | N14: 1001.7
A15: Varese | B15: 6.3255229999999996 | D15: 55 | E15: 871886 | F15: =RC[-2]/RC[-1] -> 6.3081641407248198E-5 | G15: =RC[-1]*100000 -> 6.3081641407248199 | H15: 0.29199999999999998 | L15: Molise | M15: 14.2 | N15: 1066.9000000000001
A16: Como | B16: 5.7189880000000004 | D16: 29 | E16: 586735 | F16: =RC[-2]/RC[-1] -> 4.9426061169011565E-5 | G16: =RC[-1]*100000 -> 4.9426061169011568 | H16: 0.29199999999999998 | L16: Campania | M16: 14.95 | N16: 1040.7
A17: Sondrio | B17: 4.4358940000000002 | D17: 27 | E17: 180814 | F17: =RC[-2]/RC[-1] -> 1.4932472043094008E-4 | G17: =RC[-1]*100000 -> 14.932472043094007 | H17: 0.29199999999999998 | L17: Puglia | M17: 15.9 | N17: 812.1
A18: Milano | B18: 5.7020479999999996 | D18: 240 | E18: 3038420 | F18: =RC[-2]/RC[-1] -> 7.8988421613865101E-5 | G18: =RC[-1]*100000 -> 7.8988421613865096 | H18: 0.29199999999999998 | L18: Basilicata | M18: 14.75 | N18: 865.1
A19: Bergamo | B19: 3.6981290000000002 | D19: 73 | E19: 1086277 | F19: =RC[-2]/RC[-1] -> 6.7202012009828067E-5 | G19: =RC[-1]*100000 -> 6.7202012009828067 | H19: 0.29199999999999998 | L19: Calabria | M19: 16.850000000000001 | N19: 988.9
A20: Brescia | B20: 5.2754560000000001 | D20: 84 | E20: 1238044 | F20: =RC[-2]/RC[-1] -> 6.7848961749340084E-5 | G20: =RC[-1]*100000 -> 6.7848961749340084 | H20: 0.29199999999999998 | L20: Sicilia | M20: 18.149999999999999 | N20: 836
A21: Pavia | B21: 5.50427 | D21: 37 | E21: 535822 | F21: =RC[-2]/RC[-1] -> 6.9052782453874603E-5 | G21: =RC[-1]*100000 -> 6.9052782453874606 | H21: 0.29199999999999998 | L21: Sardegna | M21: 17.45 | N21: 470.4
A22: Cremona | B22: 5.4998719999999999 | D22: 20 | E22: 357623 | F22: =RC[-2]/RC[-1] -> 5.5924814679145354E-5 | G22: =RC[-1]*100000 -> 5.5924814679145358 | H22: 0.29199999999999998
A23: Mantova | B23: 4.7550169999999996 | D23: 36 | E23: 408336 | F23: =RC[-2]/RC[-1] -> 8.8162689549782535E-5 | G23: =RC[-1]*100000 -> 8.8162689549782538 | H23: 0.29199999999999998
A24: Lecco | B24: 4.5371709999999998 | D24: 33 | E24: 336310 | F24: =RC[-2]/RC[-1] -> 9.8123754869019651E-5 | G24: =RC[-1]*100000 -> 9.8123754869019653 | H24: 0.29199999999999998
A25: Monza-Brianza | E25: 840129
A26: Lodi | B26: 5.4174519999999999 | D26: 20 | E26: 223755 | F26: =RC[-2]/RC[-1] -> 8.9383477464190738E-5 | G26: =RC[-1]*100000 -> 8.9383477464190744 | H26: 0.29199999999999998
A27: Bolzano | B27: 2.857119 | D27: 53 | E27: 504643 | F27: =RC[-2]/RC[-1] -> 1.0502474026192774E-4 | G27: =RC[-1]*100000 -> 10.502474026192774 | H27: 0.27200000000000002
A28: Trento | B28: 3.510596 | D28: 41 | E28: 524832 | F28: =RC[-2]/RC[-1] -> 7.8120236570940793E-5 | G28: =RC[-1]*100000 -> 7.8120236570940795 | H28: 0.27200000000000002
A29: Verona | B29: 4.674156 | D29: 64 | E29: 900542 | F29: =RC[-2]/RC[-1] -> 7.1068312194211934E-5 | G29: =RC[-1]*100000 -> 7.1068312194211938 | H29: 0.26700000000000002
A30: Vicenza | B30: 5.0198590000000003 | D30: 58 | E30: 859205 | F30: =RC[-2]/RC[-1] -> 6.7504262661413747E-5 | G30: =RC[-1]*100000 -> 6.7504262661413748 | H30: 0.26700000000000002
A31: Belluno | B31: 4.4330939999999996 | D31: 24 | E31: 210001 | F31: =RC[-2]/RC[-1] -> 1.1428517007061872E-4 | G31: =RC[-1]*100000 -> 11.428517007061872 | H31: 0.26700000000000002
A32: Treviso | B32: 4.7300240000000002 | D32: 53 | E32: 876790 | F32: =RC[-2]/RC[-1] -> 6.0447769705402665E-5 | G32: =RC[-1]*100000 -> 6.0447769705402665 | H32: 0.26700000000000002
A33: Venezia | B33: 5.6426319999999999 | D33: 53 | E33: 846962 | F33: =RC[-2]/RC[-1] -> 6.2576597297163273E-5 | G33: =RC[-1]*100000 -> 6.2576597297163277 | H33: 0.26700000000000002
A34: Padova | B34: 4.331474 | D34: 65 | E34: 921361 | F34: =RC[-2]/RC[-1] -> 7.0547809164920154E-5 | G34: =RC[-1]*100000 -> 7.0547809164920157 | H34: 0.26700000000000002
A35: Rovigo | B35: 3.1976849999999999 | D35: 12 | E35: 242349 | F35: =RC[-2]/RC[-1] -> 4.9515368332446184E-5 | G35: =RC[-1]*100000 -> 4.9515368332446181 | H35: 0.26700000000000002
A36: Udine | B36: 5.6207849999999997 | D36: 41 | E36: 535430 | F36: =RC[-2]/RC[-1] -> 7.6573968585996307E-5 | G36: =RC[-1]*100000 -> 7.6573968585996308 | H36: 0.27700000000000002
A37: Gorizia | B37: 5.7351559999999999 | D37: 12 | E37: 140143 | F37: =RC[-2]/RC[-1] -> 8.5626824029741045E-5 | G37: =RC[-1]*100000 -> 8.5626824029741044 | H37: 0.27700000000000002
A38: Trieste | B38: 4.6711109999999998 | D38: 7 | E38: 232601 | F38: =RC[-2]/RC[-1] -> 3.0094453592202956E-5 | G38: =RC[-1]*100000 -> 3.0094453592202957 | H38: 0.27700000000000002
A39: Pordenone | B39: 4.9186059999999996 | D39: 26 | E39: 310811 | F39: =RC[-2]/RC[-1] -> 8.3652122994359914E-5 | G39: =RC[-1]*100000 -> 8.3652122994359921 | H39: 0.27700000000000002
A40: Piacenza | B40: 2.1277089999999999 | D40: 22 | E40: 284616 | F40: =RC[-2]/RC[-1] -> 7.7297130168367203E-5 | G40: =RC[-1]*100000 -> 7.7297130168367207 | H40: 0.28599999999999998
A41: Parma | B41: 3.7678609999999999 | D41: 37 | E41: 427434 | F41: =RC[-2]/RC[-1] -> 8.6563071725693328E-5 | G41: =RC[-1]*100000 -> 8.656307172569333 | H41: 0.28599999999999998
A42: Reggio Emilia | B42: 4.9958739999999997 | D42: 52 | E42: 517316 | F42: =RC[-2]/RC[-1] -> 1.0051883181652994E-4 | G42: =RC[-1]*100000 -> 10.051883181652993 | H42: 0.28599999999999998
A43: Modena | B43: 5.1543039999999998 | D43: 43 | E43: 685777 | F43: =RC[-2]/RC[-1] -> 6.2702598658164393E-5 | G43: =RC[-1]*100000 -> 6.2702598658164392 | H43: 0.28599999999999998
A44: Bologna | B44: 3.3958710000000001 | D44: 105 | E44: 976243 | F44: =RC[-2]/RC[-1] -> 1.0755518861594911E-4 | G44: =RC[-1]*100000 -> 10.755518861594911 | H44: 0.28599999999999998
A45: Ferrara | B45: 6.4716500000000003 | D45: 30 | E45: 353481 | F45: =RC[-2]/RC[-1] -> 8.4870191042800034E-5 | G45: =RC[-1]*100000 -> 8.4870191042800034 | H45: 0.28599999999999998
A46: Ravenna | B46: 5.3111620000000004 | D46: 33 | E46: 384761 | F46: =RC[-2]/RC[-1] -> 8.5767528413742552E-5 | G46: =RC[-1]*100000 -> 8.5767528413742546 | H46: 0.28599999999999998
A47: Forl√¨-Cesena | B47: 5.8972569999999997 | D47: 42 | E47: 390738 | F47: =RC[-2]/RC[-1] -> 1.0748890560938532E-4 | G47: =RC[-1]*100000 -> 10.748890560938532 | H47: 0.28599999999999998
A48: Rimini | B48: 7.6080170000000003 | D48: 32 | E48: 321769 | F48: =RC[-2]/RC[-1] -> 9.9450226715438718E-5 | G48: =RC[-1]*100000 -> 9.945022671543871 | H48: 0.28599999999999998
A49: Massa-Carrara | B49: 11.309466 | D49: 18 | E49: 199650 | F49: =RC[-2]/RC[-1] -> 9.0157776108189337E-5 | G49: =RC[-1]*100000 -> 9.0157776108189331 | H49: 0.28699999999999998
A50: Lucca | B50: 5.986097 | D50: 28 | E50: 388327 | F50: =RC[-2]/RC[-1] -> 7.2104180239849399E-5 | G50: =RC[-1]*100000 -> 7.21041802398494 | H50: 0.28699999999999998
A51: Pistoia | B51: 5.3843189999999996 | D51: 20 | E51: 287866 | F51: =RC[-2]/RC[-1] -> 6.9476770441802787E-5 | G51: =RC[-1]*100000 -> 6.9476770441802786 | H51: 0.28699999999999998
A52: Firenze | B52: 5.0103780000000002 | D52: 77 | E52: 973145 | F52: =RC[-2]/RC[-1] -> 7.9124899167133366E-5 | G52: =RC[-1]*100000 -> 7.9124899167133362 | H52: 0.28699999999999998
A53: Livorno | B53: 5.2124519999999999 | D53: 23 | E53: 335247 | F53: =RC[-2]/RC[-1] -> 6.8606132195068111E-5 | G53: =RC[-1]*100000 -> 6.8606132195068108 | H53: 0.28699999999999998
A54: Pisa | B54: 5.5389030000000004 | D54: 39 | E54: 411190 | F54: =RC[-2]/RC[-1] -> 9.4846664558963014E-5 | G54: =RC[-1]*100000 -> 9.484666455896301 | H54: 0.28699999999999998
A55: Arezzo | B55: 5.4826790000000001 | D55: 20 | E55: 343676 | F55: =RC[-2]/RC[-1] -> 5.8194345837358444E-5 | G55: =RC[-1]*100000 -> 5.8194345837358448 | H55: 0.28699999999999998
A56: Siena | B56: 5.096762 | D56: 31 | E56: 266621 | F56: =RC[-2]/RC[-1] -> 1.1626991122229682E-4 | G56: =RC[-1]*100000 -> 11.626991122229681 | H56: 0.28699999999999998
A57: Grosseto | B57: 5.035895 | D57: 22 | E57: 220564 | F57: =RC[-2]/RC[-1] -> 9.9744291906204096E-5 | G57: =RC[-1]*100000 -> 9.974429190620409 | H57: 0.28699999999999998
A58: Prato | B58: 7.1558529999999996 | D58: 21 | E58: 245916 | F58: =RC[-2]/RC[-1] -> 8.5395012931244811E-5 | G58: =RC[-1]*100000 -> 8.5395012931244807 | H58: 0.28699999999999998
A59: Perugia | B59: 6.5455719999999999 | D59: 44 | E59: 655844 | F59: =RC[-2]/RC[-1] -> 6.7089124852861347E-5 | G59: =RC[-1]*100000 -> 6.7089124852861346 | H59: 0.26900000000000002
A60: Terni | B60: 7.1224040000000004 | D60: 18 | E60: 228424 | F60: =RC[-2]/RC[-1] -> 7.8800826533113861E-5 | G60: =RC[-1]*100000 -> 7.8800826533113861 | H60: 0.26900000000000002
A61: Pesaro e Urbino | B61: 5.9392569999999996 | D61: 29 | E61: 362583 | F61: =RC[-2]/RC[-1] -> 7.998168695167727E-5 | G61: =RC[-1]*100000 -> 7.9981686951677267 | H61: 0.28599999999999998
A62: Ancona | B62: 5.7518459999999996 | D62: 41 | E62: 473865 | F62: =RC[-2]/RC[-1] -> 8.652253278887447E-5 | G62: =RC[-1]*100000 -> 8.6522532788874464 | H62: 0.28599999999999998
A63: Macerata | B63: 5.1983459999999999 | D63: 25 | E63: 319607 | F63: =RC[-2]/RC[-1] -> 7.8221065245754948E-5 | G63: =RC[-1]*100000 -> 7.8221065245754948 | H63: 0.28599999999999998
A64: Ascoli Piceno | B64: 9.5940740000000009 | D64: 19 | E64: 210407 | F64: =RC[-2]/RC[-1] -> 9.0301178192740729E-5 | G64: =RC[-1]*100000 -> 9.0301178192740732 | H64: 0.28599999999999998
A65: Fermo | E65: 174857 | F65: =RC[-2]/RC[-1] -> 0 | G65: =RC[-1]*100000 -> 0
A66: Viterbo | B66: 11.738301 | D66: 23 | E66: 312864 | F66: =RC[-2]/RC[-1] -> 7.3514370461286689E-5 | G66: =RC[-1]*100000 -> 7.3514370461286687 | H66: 0.32300000000000001
A67: Rieti | B67: 7.9876449999999997 | D67: 8 | E67: 155164 | F67: =RC[-2]/RC[-1] -> 5.155835116392978E-5 | G67: =RC[-1]*100000 -> 5.1558351163929776 | H67: 0.32300000000000001
A68: Roma | B68: 8.1023630000000004 | D68: 221 | E68: 3997465 | F68: =RC[-2]/RC[-1] -> 5.5285036892130386E-5 | G68: =RC[-1]*100000 -> 5.5285036892130384 | H68: 0.32300000000000001
A69: Latina | B69: 10.893693000000001 | D69: 32 | E69: 544732 | F69: =RC[-2]/RC[-1] -> 5.8744483525843901E-5 | G69: =RC[-1]*100000 -> 5.8744483525843902 | H69: 0.32300000000000001
A70: Frosinone | B70: 7.4181369999999998 | D70: 17 | E70: 492661 | F70: =RC[-2]/RC[-1] -> 3.4506486204509797E-5 | G70: =RC[-1]*100000 -> 3.4506486204509796 | H70: 0.32300000000000001
A71: L'Aquila | B71: 9.8526550000000004 | D71: 13 | E71: 298343 | F71: =RC[-2]/RC[-1] -> 4.3574007099211308E-5 | G71: =RC[-1]*100000 -> 4.3574007099211309 | H71: 0.27100000000000002
A72: Teramo | B72: 5.9966879999999998 | D72: 23 | E72: 306349 | F72: =RC[-2]/RC[-1] -> 7.5077770777773068E-5 | G72: =RC[-1]*100000 -> 7.5077770777773072 | H72: 0.27100000000000002
A73: Pescara | B73: 7.9132170000000004 | D73: 18 | E73: 314661 | F73: =RC[-2]/RC[-1] -> 5.7204419994851604E-5 | G73: =RC[-1]*100000 -> 5.7204419994851605 | H73: 0.27100000000000002
A74: Chieti | B74: 8.4612970000000001 | D74: 30 | E74: 387956 | F74: =RC[-2]/RC[-1] -> 7.7328356823969734E-5 | G74: =RC[-1]*100000 -> 7.7328356823969733 | H74: 0.27100000000000002
A75: Campobasso | B75: 9.5372249999999994 | D75: 16 | E75: 226419 | F75: =RC[-2]/RC[-1] -> 7.0665447687694061E-5 | G75: =RC[-1]*100000 -> 7.0665447687694058 | H75: 0.29699999999999999
A76: Isernia | B76: 7.8927120000000004 | D76: 5 | E76: 87241 | F76: =RC[-2]/RC[-1] -> 5.7312502149218829E-5 | G76: =RC[-1]*100000 -> 5.7312502149218831 | H76: 0.29699999999999999
A77: Caserta | B77: 8.9520140000000001 | D77: 39 | E77: 904921 | F77: =RC[-2]/RC[-1] -> 4.3097684770272764E-5 | G77: =RC[-1]*100000 -> 4.3097684770272764 | H77: 0.33900000000000002
A78: Benevento | B78: 11.113664 | D78: 20 | E78: 284900 | F78: =RC[-2]/RC[-1] -> 7.0200070200070202E-5 | G78: =RC[-1]*100000 -> 7.0200070200070206 | H78: 0.33900000000000002
A79: Napoli | B79: 14.593543 | D79: 100 | E79: 3054956 | F79: =RC[-2]/RC[-1] -> 3.2733695673521976E-5 | G79: =RC[-1]*100000 -> 3.2733695673521974 | H79: 0.33900000000000002
A80: Avellino | B80: 8.0720179999999999 | D80: 17 | E80: 429157 | F80: =RC[-2]/RC[-1] -> 3.9612542729117784E-5 | G80: =RC[-1]*100000 -> 3.9612542729117783 | H80: 0.33900000000000002
A81: Salerno | B81: 14.011663 | D81: 62 | E81: 1092876 | F81: =RC[-2]/RC[-1] -> 5.6731047255132332E-5 | G81: =RC[-1]*100000 -> 5.673104725513233 | H81: 0.33900000000000002
A82: Foggia | B82: 13.632346999999999 | D82: 31 | E82: 626072 | F82: =RC[-2]/RC[-1] -> 4.9515071748936222E-5 | G82: =RC[-1]*100000 -> 4.9515071748936226 | H82: 0.316
A83: Bari | B83: 11.106175 | D83: 75 | E83: 1247303 | F83: =RC[-2]/RC[-1] -> 6.0129735918217146E-5 | G83: =RC[-1]*100000 -> 6.0129735918217149 | H83: 0.316
A84: Taranto | B84: 9.5646930000000001 | D84: 27 | E84: 584649 | F84: =RC[-2]/RC[-1] -> 4.6181555086898291E-5 | G84: =RC[-1]*100000 -> 4.6181555086898287 | H84: 0.316
A85: Brindisi | B85: 14.298385 | D85: 18 | E85: 400801 | F85: =RC[-2]/RC[-1] -> 4.4910067589651726E-5 | G85: =RC[-1]*100000 -> 4.491006758965173 | H85: 0.316
A86: Barletta-Andria-Trani | E86: 391723
A87: Lecce | B87: 16.177316999999999 | D87: 34 | E87: 802018 | F87: =RC[-2]/RC[-1] -> 4.2393063497327993E-5 | G87: =RC[-1]*100000 -> 4.2393063497327992 | H87: 0.316
A88: Potenza | B88: 10.490149000000001 | D88: 28 | E88: 377935 | F88: =RC[-2]/RC[-1] -> 7.4086813870109946E-5 | G88: =RC[-1]*100000 -> 7.4086813870109944 | H88: 0.34899999999999998
A89: Matera | B89: 12.610643 | D89: 14 | E89: 200101 | F89: =RC[-2]/RC[-1] -> 6.9964667842739413E-5 | G89: =RC[-1]*100000 -> 6.9964667842739416 | H89: 0.34899999999999998
A90: Cosenza | B90: 10.922567000000001 | D90: 37 | E90: 714030 | F90: =RC[-2]/RC[-1] -> 5.1818551041272776E-5 | G90: =RC[-1]*100000 -> 5.181855104127278 | H90: 0.316
A91: Catanzaro | B91: 11.284977 | D91: 22 | E91: 359841 | F91: =RC[-2]/RC[-1] -> 6.1138113778029746E-5 | G91: =RC[-1]*100000 -> 6.1138113778029748 | H91: 0.316
A92: Reggio Calabria | B92: 11.329685 | D92: 35 | E92: 550967 | F92: =RC[-2]/RC[-1] -> 6.352467570653052E-5 | G92: =RC[-1]*100000 -> 6.3524675706530518 | H92: 0.316
A93: Crotone | B93: 12.043611 | D93: 13 | E93: 170803 | F93: =RC[-2]/RC[-1] -> 7.6111075332400491E-5 | G93: =RC[-1]*100000 -> 7.6111075332400491 | H93: 0.316
A94: Vibo Valentia | B94: 12.851043000000001 | D94: 9 | E94: 163409 | F94: =RC[-2]/RC[-1] -> 5.5076525772754252E-5 | G94: =RC[-1]*100000 -> 5.507652577275425 | H94: 0.316
A95: Trapani | B95: 11.014453 | D95: 21 | E95: 429917 | F95: =RC[-2]/RC[-1] -> 4.8846637839396907E-5 | G95: =RC[-1]*100000 -> 4.8846637839396907 | H95: 0.35499999999999998
A96: Palermo | B96: 17.938663999999999 | D96: 59 | E96: 1243585 | F96: =RC[-2]/RC[-1] -> 4.744347993904719E-5 | G96: =RC[-1]*100000 -> 4.7443479939047188 | H96: 0.35499999999999998
A97: Messina | B97: 14.115475999999999 | D97: 31 | E97: 649824 | F97: =RC[-2]/RC[-1] -> 4.7705224799330279E-5 | G97: =RC[-1]*100000 -> 4.7705224799330281 | H97: 0.35499999999999998
A98: Agrigento | B98: 17.620056000000002 | D98: 31 | E98: 446837 | F98: =RC[-2]/RC[-1] -> 6.9376528801330233E-5 | G98: =RC[-1]*100000 -> 6.9376528801330233 | H98: 0.35499999999999998
A99: Caltanissetta | B99: 15.333284000000001 | D99: 24 | E99: 273099 | F99: =RC[-2]/RC[-1] -> 8.7880219261147059E-5 | G99: =RC[-1]*100000 -> 8.7880219261147055 | H99: 0.35499999999999998
A100: Enna | B100: 15.158867000000001 | D100: 14 | E100: 173451 | F100: =RC[-2]/RC[-1] -> 8.0714438083378018E-5 | G100: =RC[-1]*100000 -> 8.0714438083378024 | H100: 0.35499999999999998
A101: Catania | B101: 11.319677 | D101: 45 | E101: 1078766 | F101: =RC[-2]/RC[-1] -> 4.1714329150158607E-5 | G101: =RC[-1]*100000 -> 4.1714329150158607 | H101: 0.35499999999999998
A102: Ragusa | B102: 8.9370139999999996 | D102: 24 | E102: 307492 | F102: =RC[-2]/RC[-1] -> 7.8050811078011787E-5 | G102: =RC[-1]*100000 -> 7.805081107801179 | H102: 0.35499999999999998
A103: Siracusa | B103: 8.4864040000000003 | D103: 17 | E103: 399933 | F103: =RC[-2]/RC[-1] -> 4.2507119942590383E-5 | G103: =RC[-1]*100000 -> 4.2507119942590386 | H103: 0.35499999999999998
A104: Sassari | B104: 18.970690999999999 | D104: 31 | E104: 328043 | F104: =RC[-2]/RC[-1] -> 9.449980642781586E-5 | G104: =RC[-1]*100000 -> 9.4499806427815862 | H104: 0.29399999999999998
A105: Nuoro | B105: 10.107704999999999 | D105: 20 | E105: 159197 | F105: =RC[-2]/RC[-1] -> 1.2563050811259006E-4 | G105: =RC[-1]*100000 -> 12.563050811259007 | H105: 0.29399999999999998
A106: Cagliari | B106: 10.980675 | D106: 63 | E106: 550580 | F106: =RC[-2]/RC[-1] -> 1.1442478840495478E-4 | G106: =RC[-1]*100000 -> 11.442478840495477 | H106: 0.29399999999999998
A107: Oristano | B107: 13.925041999999999 | D107: 12 | E107: 163916 | F107: =RC[-2]/RC[-1] -> 7.3208228604895194E-5 | G107: =RC[-1]*100000 -> 7.3208228604895194 | H107: 0.29399999999999998
A108: Olbia-Tempio | B108: 14.175371999999999 | D108: 14 | E108: 150501 | F108: =RC[-2]/RC[-1] -> 9.3022637723337386E-5 | G108: =RC[-1]*100000 -> 9.3022637723337382 | H108: 0.29399999999999998
A109: Ogliastra | B109: 12.663876 | D109: 11 | E109: 57329 | F109: =RC[-2]/RC[-1] -> 1.9187496729403965E-4 | G109: =RC[-1]*100000 -> 19.187496729403964 | H109: 0.29399999999999998
A110: Medio Campidano | B110: 11.892898000000001 | D110: 13 | E110: 101256 | F110: =RC[-2]/RC[-1] -> 1.2838745358299754E-4 | G110: =RC[-1]*100000 -> 12.838745358299754 | H110: 0.29399999999999998
A111: Carbonia-Iglesias | B111: 11.833587 | D111: 13 | E111: 128540 | F111: =RC[-2]/RC[-1] -> 1.01135833203672E-4 | G111: =RC[-1]*100000 -> 10.1135833203672 | H111: 0.29399999999999998